{
  "$schema": "https://json-schema.org/draft/2020-12/schema",
  "$id": "https://zega.dev/schemas/contract.schema.json",
  "title": "zega graph-component contract (APS 21)",
  "description": "What a graph component accepts: data roles (typed, with units), surface parameters and display options (each a JSON Schema with a default). Agents and the /components gallery read this file; the runtime validates view specs against it.",
  "type": "object",
  "required": ["id", "version", "title", "category", "surface", "mark", "roles", "surfaceParams", "options"],
  "additionalProperties": false,
  "properties": {
    "$schema": { "type": "string" },
    "id": { "type": "string", "pattern": "^[a-z][a-z0-9]*(-[a-z0-9]+)*$" },
    "version": { "type": "string", "pattern": "^[0-9]+\\.[0-9]+\\.[0-9]+$", "description": "Semver. A major bump means old view specs no longer bind." },
    "title": { "type": "string", "minLength": 1 },
    "category": { "enum": ["Geo", "Sports", "Network", "Charts"] },
    "description": { "type": "string" },
    "surface": { "type": "string", "description": "The surface this component draws on, e.g. \"map\"." },
    "mark": { "type": "string", "description": "The mark it draws, e.g. \"path\"." },
    "roles": {
      "type": "object",
      "description": "Data roles by name.",
      "additionalProperties": { "$ref": "#/$defs/role" }
    },
    "surfaceParams": { "type": "object", "additionalProperties": { "$ref": "#/$defs/setting" } },
    "options": { "type": "object", "additionalProperties": { "$ref": "#/$defs/setting" } },
    "example": {
      "type": "object",
      "description": "A worked example: the ZQL, and the view spec that binds its result.",
      "required": ["zql", "spec"],
      "properties": { "zql": { "type": "string" }, "spec": { "type": "object" }, "sample": { "type": "string" } }
    }
  },
  "$defs": {
    "role": {
      "type": "object",
      "required": ["type", "required", "description"],
      "additionalProperties": false,
      "properties": {
        "type": { "enum": ["lonlat[]", "f64[]", "f64", "string"], "description": "lonlat[]: ordered [lon, lat] pairs, or ZQL Point values ({lat, lon}). f64[]: finite numbers. string: text." },
        "required": { "type": "boolean" },
        "ordered": { "type": "boolean", "description": "The role's list order is meaningful (a path's points in sequence). Bind it from an `order by` selection." },
        "unit": { "type": "string" },
        "minItems": { "type": "integer", "minimum": 0 },
        "sameLengthAs": { "type": "string", "description": "Another role whose list this one must match in length, item for item." },
        "description": { "type": "string" }
      }
    },
    "setting": {
      "type": "object",
      "required": ["default", "description"],
      "description": "A JSON Schema for one parameter or option, plus its `default`.",
      "properties": {
        "default": {},
        "description": { "type": "string" },
        "type": {},
        "enum": { "type": "array", "minItems": 1 },
        "minimum": { "type": "number" },
        "maximum": { "type": "number" }
      }
    }
  }
}
